{"schema_version":"0.4.0","profile":"layered-depth-2d","completeness_policy":"layered-depth-2d-complete-v1","bounds":{"x":0,"y":0,"width":1280,"height":720},"spawn":{"x":96,"y":470},"ground_segments":[{"id":"far-boundary","from":{"x":40,"y":300},"to":{"x":1240,"y":300},"one_way":false},{"id":"middle-guide","from":{"x":40,"y":470},"to":{"x":1240,"y":470},"one_way":true},{"id":"near-boundary","from":{"x":40,"y":650},"to":{"x":1240,"y":650},"one_way":false}],"blockers":[{"id":"west-rock","rect":{"x":342,"y":390,"width":58,"height":68}},{"id":"east-landmark","rect":{"x":900,"y":310,"width":92,"height":80}}],"hazards":[{"id":"deep-water","kind":"fall","rect":{"x":500,"y":625,"width":140,"height":25}}]}
